#Source	#Target	#Sentence
Shepherds	government	Citizen Sheep Government Shepherds
shepherd	government	Such a power does not destroy, but it prevents existence; it does not tyrannize, but it compresses, enervates, extinguishes, and stupefies a people, till each nation is reduced to nothing better than a flock of timid and industrious animals, of which the government is the shepherd.
shepherd	Obama and the Progressives	Obama and the Progressives do not believe this. They believe they must decide what is best. In their view Americans are sheep and they are the shepherd.
cater	government	The government should cater to the needs of its citizens.
policeman	government	A proper government is only a policeman, acting as an agent of man’s self-defense, and, as such, may resort to force only against those who start the use of force.
loves	government	The US government loves you. In fact, it loves you so much that it’s willing shackle your legs together. Just to protect you – tough love, baby. Now, it may hurt a bit but just try to breathe through the pain. Remember – it hurts the government more than it hurts you.
infected	government	The government is infected with corruption.
cure	democracy	We must cure our ailing democracy with an infusion of new politicians.
Parent	Government	Big Father: The Government as Parent
parent	country	"Doctrine of Parens Patriae."" Parens Patriae means literally, ""parent of the country."" It refers traditionally to the role of STATE as sovereign and guardian of persons under legal disability."
lead	government	"""In my view, the federal government should lead the way.  The bill we’ve introduced requires the federal government to increase its use of renewable electricity and reduce its overall energy consumption in federal buildings, both new and old.  We can’t expect consumers to embrace energy efficient technology if their government does not do the same."""
follow	government	Parents are so uneducated about health that they will follow the government down any misguided path.
driving	government	The Syrian government is driving Syria into a dangerous zone.
steering	government	The current Japanese government is steering the country toward Socialism.
cure	government	to promote his fantasy that big government can cure our nation's ills.
Cancerous	Government	Once the stage has been set, radical surgery will be required to actually remove the malignant tumor that Cancerous Government has become.
babysitter	government	I believe in personal responsibility and the government shouldn't be a babysitter but I also believe in compassion for less advantageous people.
nanny	state	Can I decide what size soda I want to drink? No, that’s the nanny state’s job.
financial disarray	government	One of the worst-run businesses in the United States is also the largest business in the nation. The federal government is in financial disarray. It spends more than it makes and its investments are not based on sound financial principles.
topple	governments	Rising food prices can topple governments
collapse	government	Afghanistan's government could collapse after 2014.
machine	government	If the injustice is part of the necessary friction of the machine of government, let it go, let it go: perchance it will wear smooth--certainly the machine will wear out. If the injustice has a spring, or a pulley, or a rope, or a crank, exclusively for itself, then perhaps you may consider whether the remedy will not be worse than the evil; but if it is of such a nature that it requires you to be the agent of injustice to another, then I say, break the law. Let your life be a counter-friction to stop the machine. What I have to do is to see, at any rate, that I do not lend myself to the wrong which I condemn.
conduct	government	They had elected him (Jackson) to conduct the Government and to keep and remove its moneys, and he meant to do so on the principle that it was a simple machine.
shoulders	government	This responsibility falls squarely on the shoulders of the government.
toppled	government	The government was toppled.
fell	government	The government fell.
ocean	debt	The western world is drowning in an ocean of debt unlike anything the world has ever seen before
lean on	government	In times of need, the impoverished should be able to lean on our government for support.
safety net	welfare	We need welfare as a safety net.
addicted	welfare	Our country's poor are addicted to welfare.
addicts	welfare	We have a nation of welfare addicts who will always depend on the government for their next fix.
trapping	state dependency	...trapping so many people in state dependency robs them of their human dignity.
trap	welfare	[T]he federal government's welfare assistance programs intended to help those in need instead effectively trap people into dependence
handout	government	The government shouldn't just give handouts, it needs to encourage people to get jobs instead.
moved	Congress	Congress moved quickly to avoid a governmental shutdown.
took a step	state	The state took a big step toward banning assault weapons.
approach	legislature	The legislature is considering an alternative approach to deficit reduction.
roadblocks	bills	Postal Service bill faces roadblocks
path	prosperity	Our President will chart a path to prosperity.
waters	recession	We will navigate the choppy waters of recession into smooth fiscal sailing.
navigate	economy	'Pakistan's economy has ability to navigate through choppy waters'
churned out	bill	With a heavy Republican majority, Congress churned out bill after bill.
well-oiled gears	government	With a unified House and Senate, the well-oiled gears of government turn smoothly.
wheels	legislation	"""I look forward to helping keep the legislative wheels turning smoothly in our 105-day session"""
gears	legislative	Cloture would make the legislative gears turn smoothly.
spelled out	theory	The theory is spelled out in chapter 4.
letter	law	Follow the letter of the law.
well-crafted	sentence	This is a well-crafted sentence.
articulated	Promises	Promises should be articulated clearly.
large	force	A large force is needed to move a heavy object.
gave	push	She gave him a push.
gave	kick	He gave me a vicious kick.
blood	cost	Again, if by any chance, we should ultimately win out in such a war, what would it cost us in treasure and in blood?
parasites	welfare	Should Welfare parasites be allowed to bleed working Americans for the rest of their lives without attempting to help themselves?
have	headache	I have a headache.
in	love	I'm in love.
out	depression	She's out of her depression.
close	insanity	She's close to insanity.
goes	hibernation	When at rest, the computer goes into hibernation.
is at	advanced stage	He's at an advanced stage in his studies.
in	state	What state is the project in?
approaching	headache	I can feel a headache approaching
went away	symptoms	My symptoms went away.
dark forces	Satan	The Bible clearly teaches that our struggle to live righteously is a struggle against the dark forces of Satan that seeks to rule us.
shock	environment	The oil spill has caused a shock to the environment.
malaise	environmental	Smog pollution is an environmental malaise.
nursing	Bay	Ecologists are nursing the Bay back to health.
leeches	takers	"The ""takers"" in this society are leeches on the success of job creators."
reaching the end	process	We are reaching the end of the house-buying process.
reach	goals	Finally, all my educational goals are in reach.
entering	stages	We are entering the last stages of filing for bankruptcy.
push through	legislation	Democrats Push Through Historic, Controversial Health Care Legislation
move	bill	The Senate voted 92-5 Tuesday to move the bill forward to a full vote later this week.
filled	jealousy	He's filled with jealousy.
overflowing	love	She's overflowing with love.
set aside	jealousy	You have to set your jealousy aside.
hid	love	He hid his love from her.
fiery	passions	He is a man of fiery passions.
cooled off	relationship	Their relationship cooled off and they soon parted ways.
cold	unloving	His mother was always cold and unloving when he was a child.
bursting	excitement	He's bursting with excitement.
side-splittingly	funny	That joke is side-splittingly funny.
fight	White House	...the fight for the White House is being waged on intensely local terrain...
war	presidency	the war for the presidency is nearly over
fight	election	Both sides girded for battle, as they knew the general election would be a hard-won fight.
Tactics	Campaign	Campaign Craft: The Strategies, Tactics, and Art of Political Campaign Management
race	presidential	The GOP presidential race has a new front-runner: Gov. Rick Perry.
race	election	This year's US presidential election is shaping up to be a very close race, with the incumbent currently in front, but his challenger close on his heels.
finish line	election	Noem sprints to election finish line with stop in Elk Point, SD.
running	candidates	With the official start of primary season, candidates were off and running as they sought to quickly raise millions of dollars for ad buys.
marathon	primary-election	The Iowa caucuses in January 2012 serve as the starting line of the marathon primary-election campaigns necessary ...
race	governor	Hutchinson the front-runner in 2014 governor's race
chessboard	national	Too often it is post mortem head scratching, as if democratic strategists do not realize every candidate is a pawn on the national. chessboard
round	Democratic primary	Beasley won the first round of Democratic primary for lieutenant governor in 1970, but failed to win a majority.
lean	government	Randy has a plan to turn a bloated government of Washington bureaucrats into a lean and efficient government
well oiled machine	efficiency	Our state government, a well oiled machine of efficiency.
flabby	government	Like some it is supposed to serve, Massachusetts government has become flabby.
stakes	testing	Apparently, I’m not the only parent who’s concerned about high stakes testing.
resource	education	A good education is a powerful resource.
humming	economy	With The Economy Humming, Will Manufacturing Software Help Manufacturers Stay In Tune?
engine	economic	"""Although we have a long way to go before we can put this recession behind us, the gears of our economic engine do appear ... to be slowly turning once again,"""
falling apart	economy	The economy is falling apart.
health	economy	force-feed the economy back to health
makes me sick	thought	The very thought of it makes me sick.
victory	epidemic	The doctors at the CDC led the way to victory against the flu epidemic.
battle	cancer patient	The cancer patient fought a long, hard, battle, but she eventually succumbed to her disease.
war	cancer	A Triumph in the War Against Cancer
arsenal	leukemia	With nothing left in their leukemia-fighting arsenal, the doctors were down to Dilaudid, a derivative of morphine...
weapons	diplomacy	The Weapons of Diplomacy, and the Human Factor
bear	hard	This situation is hard to bear.
hard	problem	This is a very hard problem to solve.
going nowhere	life	My life is going nowhere - I'm just spinning my wheels.
hurdles	relationship	We have a lot of hurdles to get over in our relationship.
faced	problems	They faced some tough problems at the beginning of their marriage but got over them quickly.
different way	solved	She solved the problem a different way.
cultivate	openness	Tips on how to cultivate openness to change.
sale	democracy	democracy for sale
seeds	democracy	plant the seeds of democracy
blossoms	democracy	democracy blossoms
fledging	democracy	fledgling democracy
wings	democracy	democracy spreads its wings
high	moral standards	He is a person of very high moral standards.
holding back	" debt"	Debt is holding me back from reaching my goals.
growing	debt	Credit card debt has been growing significantly
strike blows	Obama and Romney	Obama and Romney Strike Blows Over Benghazi
attacked	criticism	He attacked the speaker with harsh words of criticism.
beast	crime	Crime is a beast ravaging the city.
infected	crime	Crime has infected communities everywhere.
grow	legislation	Out of these discussions will grow legislation of farreaching importance.
eroding	corruption	Corruption is eroding the public trust in government.
termites	corruption	Our nation has been infested with the termites of corruption, the worms of immorality, and a virus of indifference and apathy.
cancer	corruption	Our government is afflicted with the cancer of corruption.
infecting	corrupt officials	Corrupt officials are infecting our government at every level.
wave	corruption	California Cities Struggling Under Wave of Corruption
tsunami	corruption	FIFA facing corruption 'tsunami'
under	control	Relax. We've got everything under control.
high	command	He's in the high command.
upper	echelon	He's in the upper echelon.
rose	power	His power rose.
hold	power	The president kept his hold on power.
regained	control	She regained control of the assembly.
beyond	control	His actions are beyond my control.
out	control	The whole situation spiraled out of (our) control.
returned	power	He returned to power.
in	control	The president is in control of the executive branch.
gobbling up	fossil fues	Developing nations are gobbling up our fossil fuels at any alarming rate.
appetite	consume	The United States' insatiable appetite for electronics will entirely consume our supply of rare metals.
guzzler	gas	This SUV sure is a gas guzzler.
eating away	forests	Demand for paper goods is eating away at our planet's forests.
trump	Constitutional rights	“Your dead kids don’t trump my Constitutional rights.”
up	wake	Wake up!
drove	vanity	Vanity finally drove me to have the operation.
pulling ahead	playing	We’ve been playing chess for years, and he’s finally pulling ahead of me.
better writer	widening	He’s a better writer than I am, and he’s widening the distance.
restructure	firm	We have to restructure this firm.
gave	idea	You gave me a great idea!
pack	words	Try to pack more thoughts into fewer words.
capturing	words	Whenever you have a good idea practice capturing it in words.
across	thoghts	Try to get your thoughts across better.
give	idea	You still have to give me an idea of what you mean.
racing	mind	My mind was racing.
tired	mind	My mind is tired.
slavery	individuals	This new slavery is a total dependence by individuals and families on government for the materials and funds necessary to maintain a minimum standard of living.
enslaved	state	...the people of America’s needs and priorities become second to the needs of the state and the people of America become enslaved to the state.
eyes and ears	citizens	Snitch Culture: How Citizens are Turned into the Eyes and Ears of the State
protect	rights	We need to protect our rights from infringement.
protect	rights	Do gun rights protect against tyranny?
take away	right	Don't let anyone take away your right to vote.
pillars	rights	One down of the three pillars of “unalienable” rights that hold up this great country of ours.
dismantle	rights	This is an usagainst-them battle, but the “them” are those who would dismantle our rights.
gone	from bad to worse	Things have gone from bad to worse lately.
handed	control	The US handed over control of the prisoners to Afghan authorities.
wrested	control	The Democrats wrested control of four governerships from the Republicans
acquired	control	The government acquired control of the company's assets.
gagged	media	... allow courts to circumvent the First Amendment, slowly eroding the freedom of the press in a much more subtle manner than if they gagged the media directly.
muzzle	press	The government should not muzzle the press.
cripple	economy	Another round of cuts will cripple the economy.
treatment	crime	Thriving community centers have proven to be an effective treatment against violent crime in a number of neighborhoods.
within	category	Tomatoes technically fall within the fruit category.
put	category	I wouldn't put him in the friend category, exactly.
make	career	How to make a career out of things you would do even for free.
collapsed	career	Stars whose careers collapsed in a relatively short amount of time
grow	business	Here are some tips to grow your business.
machine	bureaucratic	You could call me just a work-for-hire hack, and a willing, contented cog in a bureaucratic machine.
cogs	bureaucracy	Confronted with the grinding cogs of bureaucracy, but needing a new cap, Coltrane shrugged and filled out the form.
tentacle	bureaucrats	The creation of this board of unelected bureaucrats is yet another tentacle of the Obama Administration digging its way into the doctors-patient relationship.
maze	bureaucratic	Lost in the bureaucratic maze of city's criminal justice system
filled	anger	He was filled with anger.
contain	joy	She couldn't contain her joy.
briming	rage	She was brimming with rage.
hold on	beliefs	Hold on to your beliefs and never let them go.
stoop	behaviour	I refuse to stoop to that kind of behavior.
given	authority	In a democratic government, authority is given to it by the people.
has	sunny disposition	She has a sunny disposition.
lost	charm	This place has lost a lot of its charm.
gave	appearance	The new mustache gave him an older appearance.
got	control	You could talk about the dealerships, auto dealerships that were closed down when the government got control of a couple of the auto companies, an awful lot of people lost jobs, businesses were closed, and so on.
seized	control	The Shadow Party: How George Soros, Hillary Clinton, and Sixties Radicals Seized Control of the Democratic Party
leaning on	friends	I've really been leaning on my friends the past few months.
made up	five	Five is made up of two plus three.
put	2 and 2	If you put 2 and 2 together, you get 4.
bombarded	arguments	He bombarded them with clever arguments.
target	criticisms	His criticisms were right on target.
indefensible	claims	Your claims are indefensible.
attacked	argument	He attacked every weak point in my argument.
target	criticisms	His criticisms were right on target.
blew	argument	I blew his argument out of the water.
won	argument	I've never won an argument with him.
shoot	disagree	You disagree? OK, shoot!
shot down	argument	He shot down all of my arguments.
burst	anger	He was just about to burst with anger.
friendship	Iran	There seems to be growing friendship between Shia Iran and its Sunni-dominated neighbours.
fanatics	gun control	Of course, gun control fanatics pay little attention to facts.
war	obesity	The most powerful weapon in the war against obesity might be something we all understand: cold, hard cash.
war	poverty	How America's losing the war on poverty
ails	economy	Debt Ceiling Deal: Wrong Diagnosis Leads to Wrong Treatment for What Ails the Economy
cure	poverty	Improving access to education is the only sure way to cure us of poverty.
reining	criminals	Law enforcement officers have often described these arrests as a way of reining in criminals whose other, more serious activities present a danger to the public.
course	investigation	In the course of the investigation, new evidence was found.
follow	assemble	Follow along as I assemble this.
follow	assembly	Follow these steps in assembly.
get out	washing	How did Jerry get out of washing the windows?
outside	washing	Outside of washing the windows, what else did you do?
put	washing	I put a lot of energy into washing the windows.
out	washing	I get a lot of satisfaction out of washing windows.
way	squeezed	She squeezed her way to thinner thighs.
went	sleep	She went back to sleep.
navigated	negotiations	She successfully navigated her way through the contract negotiations.
moving	refusal	Congress' refusal to compromise is moving the country toward economic ruin.
in	motion	The car is in motion.
going to	leave	I'm going to leave.
close	resigning	She's close to resigning.
ate	idea	We pitched them the idea and they ate it right up.
feeding	lies	He's been feeding her lies all these years.
digest	article	This article is hard to digest.
rise	power	Hitler's rise to power cannot be attributed to one event, but a mixture of factors including events happening outside Germany...
peak	influence	Regensburg’s political influence reached its peak when Regensburg was city of the Perpetual Diet or General Assembly of the Imperial Estates of the Holy Roman Empire from 1663 to 1806.
way	goal	The goal is a long way off.
handed	job	They just handed him the job.
seize	opportunity	Seize the opportunity.
escaping	world championship	I kept getting close to a world championship, but it kept escaping me.
get	smile	He finally managed to get a smile out of her.
landed	accounts	She landed four huge accounts this year.
bullied	House Republicans	Will House Republicans Get Bullied into a Tax Hike By Obama?
pushed around	he	On the other hand, it's making him look indecisive, and as Pat said, he's being pushed around by the generals, by the Secretary of State and by others.
exposed	issue	The issue was exposed to the light of day.
clouded	judgement	His judgement is clouded.
