#Source	#Target	#Sentence
transparency	Government	Government transparency enables the public to hold the government accountable for how they spend their money.
transparency	authorities	Beijing has encouraged regional authorities to introduce sunshine policies that tackle corruption through increased transparency.
hot	temper	He has a hot temper.
burning	rage	He's burning with rage.
inflammatory	remarks	Those are inflammatory remarks.
consumed	anger	He was consumed by his anger.
oceans	poverty	WE CANNOT HAVE ISLANDS OF PROSPERITY NEXT TO OCEANS OF POVERTY AND SQUALOR
flood	guns	flood of guns
flood	violence	We have not found a way to stem this rising flood of gun violence.
ocean	violence	We are drowning in an ocean of gun violence.
path	life	He started going down a bad life path.
impenetrable	remark	That remark is completely impenetrable.
possesses	parts	The eye possesses several parts.
belongs	part	Which car part belongs to which car?
hum	bureaucracy	Despite the debt crisis, the welfare bureaucracy continued to hum along, producing checks every month.
cost	human	The human cost of that disaster is enormous.
spoken	voters	The voters of Dillon have clearly spoken.
full	view	The island is now in full view.
rebuild	trust	We are working hard to rebuild the trust of our customers.
foundations	trust	The scandals have shaken the foundations of trust in the market.
collapsed	trust	It is how, in every Western country, trust in government has suddenly, dramatically collapsed in the crisis' aftermath.
full	morning	My morning has been very full.
spent	day	We spent all day at the fair.
theft	time	Time-theft
flow	time	The flow of time
sands	days	Like sands through the hourglass, so are the days of our lives.
valuable	time	Our time is valuable.
flies	time	Time flies.
come	time	The time will come when…
gone	time	The time has long since gone when…
arrived	time	The time for action has arrived.
back	time	You can't go back in time!
ahead	future	We're looking ahead to the future.
front	future	He has a great future in front of him.
waste	time	Don't waste your time.
think	hear	I can barely hear myself think.
articulate	thinker	He's an articulate thinker.
listen	conscience	She doesn't listen to her conscience.
toss	ideas	Let's toss some ideas around.
read	mind	I can't read her mind.
misread	intentions	I misread his intentions.
interconnected	factors	Her theory requires the reader to understand  many interconnected factors.
dismantle	theory	Opponents tried to dismantle the theory piece by piece.
foundation	theory	This theory has a solid foundation.
filled	framework	The theoretical framework needs to be filled in with empirical data.
lost	control	The dummies were 2-to-1 in favor of the Arizona immigration law; the court gutted it. Only those dummies, not in a state of denial, understand that we the people have lost control of our government.
gave	control	But meanwhile, you may not have noticed that our government gave away control of the Internet.
disease	taxes	"During a panel discussion that included Washington Governor Christine Gregoire and Nevada Governor Brian Sandoval, Brown accused California lawmakers of adhering to ""the notion that taxes are like some kind of sexually transmitted disease,"" the Los Angeles Times reports."
infect	taxes	Those insidious taxes infect every aspect of our lives.
steals	taxes	Government steals the people's wealth through overt and hidden taxes
slaves	tax	America Tax Slaves Work 6.5 Months Every Year to Pay for Government
punishes	taxation	The state cannot pay its bills and poorly educates its young, and its taxation punishes whatever success that its suffocating regulatory regime does not prevent.
hurt	taxes	High sales taxes hurt local small businesses.
death	taxed	We are being taxed to death!
burden	tax	According to the Tax Foundation, Texas residents on average shoulder the fifth lowest tax burden compared to other residents in the 50 states.
heavy load	tax plan	"The Obama campaign is taking a swipe at Mitt Romney's tax plan in a new television ad, saying it will create a ""heavy load"" for the middle class."
heavy	taxes	President Obama decided to target certain and specific products or services he deems unhealthy and levied heavy taxes on them.
impose	taxes	Remember when President Obama literally laughed out loud at the idea his health-care plan would impose taxes on the middle class?
burden	tax	The new president delivered on his tax cut promises, which, combined with a recession in 2001, caused the tax burden to fall considerably.
burdensome	taxes	New Taxes Burdensome for Farm and Ranch Families
under	control	He is under my control.
fell	power	He fell from power.
decline	power	His power is on the decline.
fell	status	She fell in status.
climber	social	He's a social climber.
plateau	career	I reached a plateau in my career some years back.
steps	independence	East Timor took the first steps toward independence in the 1990s.
moving	recession	The country is slowly moving out of recession.
suffering	society	Our society is suffering from many social problems.
part	society	Functionalism interprets each part of society in terms of how it contributes to the stability of the whole society. Society is more than the sum of its parts; rather, ...
ills	social	A cure for social ills? Prevention
curing	problem	UW researcher is a leader in showing how prevention techniques can pay off in curing social problems.
gangrene	dishonesty	Our society is turning gangrene with dishonesty.
growing	business	My business is growing like a weed.
circle	friends	Our circle of friends is quite diverse.
penetrated	group	He's hasn't penetrated that group.
foundations	establishment	He's about to rock the foundations of the literary establishment with his novel.
building	queues	By early afternoon, queues were already building up.
fabric	social	Cop scandals fray the social fabric.
near	color	Her hair is very near to his in color.
far	perfect	That's far from a perfect circle.
adopted	customs	They adopted the customs of their neighbors.
looking for	meaning	He's looking for meaning in his life and isn't finding any.
scoured	horizon	His eyes scoured the horizon.
shot up	temperature	The temperature shot up.
rose	consumption	Fuel consumption rose to the highest it has been in 20 years.
sank	spirits	My spirits sank.
veering	relationship	Our relationship is veering off-course.
going	relationship	It feels like this relationship is going nowhere.
toppled	dictatorship	The coup toppled the brutal dictatorship.
structure	Europe	The Revolutionary and Napoleonic Wars tore down the ancient structure of Europe
built	relationship	Their relationship is built on a solid foundation of trust and commitment.
solid	relationship	Our relationship is rock solid.
fragile	relationship	She has a fragile relationship with her mother as it is.
build	relationship	It takes work to build any relationship.
closely	related	These ideas are closely related.
prune	legislation	I concede that it has become indispensable to prune legislation, but it seems to me that this must be done with prudence and thought.
fell	income	His income fell last year.
size	bank account	What is the size of your bank account?
big	debt	He doesn't know how big our national debt is.
approach	solving	We are trying to find the most elegant approach to solving this problem.
strides	dissertation	She made great strides in her dissertation.
scrubbed clean	soul	Her soul was scrubbed clean of impurities.
cleanse	soul	You must cleanse your soul of sin.
washed	impure	The impure must be washed clean through contrition.
wounded	accusation	The accusation wounded her.
wounded	pride	My pride was wounded.
wound	psyche	She recovered from the wound to her psyche, but scars remained.
peaks	life	Life is full of peaks and valleys.
headway	writing	He hadn't made much headway in writing the termpaper.
move forward	bill	House Republicans blocked the Democrats' attempts to move forward with the healthcare bill.
passage	bill	The Senator's filibuster halted the passage of the bill.
half-baked	ideas	They're just half-baked ideas.
raw	facts	Just give me the raw facts.
holds	power	He holds all the power.
vines	poverty	We are not free from the creeping vines of poverty.
weeds	poverty	Mother Martha is working to loosen the strangling weeds of poverty and watching children blossom and thrive under her care.
chained	poverty	Though politically the country is free, its people remain chained by poverty.
epidemic	poverty	The epidemic of poverty is spreading in America, and it's taking its toll on American families.
symptoms	poverty	As President Obama has said, we can't treat the symptoms of poverty in isolation.
crime	poverty	He appealed to logos (logic) by trying to analyze why poverty is a crime and tries to differentiate it from being poor.
wildfire	revolution	The wildfire of revolution rapidly spread throughout the land.
ship	state	They are rocking the ship of state.
ship	state	Dirt threatens to sink ship of state
declined	strength	His strength declined as he aged.
race	Election	As Election Day drew near, the candidates pulled into the final lap of the race.
Race	Campaign	Last Legs of Campaign Can Decide Race
leg	campaigning	How both candidates fair in the final leg of campaigning will likely determine the winner in each state.
green	man	The young man is rather green and does not have enough experience to drive the large machinery.
withered	woman	We saw the withered old woman.
sustanance	panic	Incurable sex offenders, lousy judges and the new media: Moral panic sustenance in the age of new media
fell apart	defense	The Lakers' defense fell apart in the final quarter leading to an embarrassing upset.
door	opportunity	Opportunity is an open door.
paths	opportunity	His job offer opened up new paths of opportunity for him.
squandered	opportunity	I've squandered every opportunity to advance my career.
neighbors	Canada	Canada is by far the closest of all our neighbors.
want	Mother Nature	3rd #WinterWeatherAdvisory in 3 weeks. Think #MotherNature doesn't want an early spring :P
tease	Mother nature	Dear #Mothernature , please don't tease us Texans with this awesome weather until you plan on staying this way. Thanks:)
tries	Nature	Nature Tries to Shift Outer Banks, But Man Keeps Shoveling It Back
value	nature	... we must deepen our understanding of the economic value of nature and invest in the vital services that it provides for us, if we are to have a truly sustainable economic future.
comes	environment	To start with, everything we are made of and everything we make comes from the environment.
bully	U.S.	International Poll Finds U.S. Still Viewed As World's Bully
Outlaw	States	Great Powers and Outlaw States: Unequal Sovereigns in the International Legal Order
goalposts	debate	Obama accused the Republicans of moving the goalposts in the debate about the deficit.
Battlefield	Political	Women: We Want You on the Political Battlefield
broken	system	But Scott Brown’s win in the Massachusetts Senate race does raise a bigger question: is the system broken? I fear the answer is yes.
foundation	nation	The infrastructure that is the foundation of our nation is eroding, endangering the whole structure of our economy.
contains	nation	Our nation contains some of the best entrepreneurs in the world.
stands	United States	Only one thing stands between Western civilization and chaos: the United States.
gears	nation	Saltykov explored the psychological problems resulting from the shifting of a nation's gears, of creating a new way of life.
rouse	nation	We must rouse our nation from its slumber.
grind	country	If the President doesn't show some leadership, the country will grind to a halt.
functions	country	...and asked them to be serious towards bringing a full-fledged budget at the earliest to ensure that the country functions smoothly.
family	national	Our national arguments are family arguments, we still talk to each other at the end of the day.
parts	nation	"""Are They Parts of Our Nation? Tanzanian and Zambian University Students’ Attitude to the European and South Asian Minorities Compared"""
built	nation	No one built this country on their own. This nation is great because we built it together.
build	nation	“This is a time to build a nation, brick by brick, pillar by pillar, not a time to tear down our brothers and sisters or pillage their property,”
brick	nation	They represent the brick and mortar of our nation's developing infrastructure.
built	nation	"""Our nation is built on the bedrock principle that governments derive their just powers from the consent of the governed."""
body	nation	Within a federalist framework the nation is a body in crisis threatened from within by one of its own. It is about to be dismembered.
heart	nation	Iowa is the heart of the nation, where everyone greets you with a smile and you wave at strangers!
ship	state	Scuttling the Ship of State to appease climate activists
sink	country	Our country is burdened by debt and that may sink us in the rough waters ahead.
covered	sheep	The grazing field was covered with sheep.
expanding	number	The city is expanding the number of recycling containers in parks.
straight	god-fearing	God-fearing men must keep strictly to the straight and narrow.
take care	government	The government takes good care of its people.
bankrupt	morally	He's morally bankrupt.
flow	cash	cash flow
gushing out	money	The money is gushing out of my retirement account.
dried	money	The money is all dried up.
liquid	assets	Liquid assets.
grind	solution	We're still trying to grind out the solution to this equation.
operating	mind	My mind isn't operating today.
in	mind	It's all in your mind.
back	mind	Keep it in the back of your mind.
calculated	decision	She came to a calculated decision.
note	mental	Let me make a mental note of that.
imprinted	mind	It's imprinted in my mind forever.
applies	law	It is unclear how the new law applies to this situation.
weigh	issue	Before we draw any conclusions, we must weigh both sides of the issue.
dying	engine	The engine is dying; we need to repair it.
overpower	Obama	It was a hard-fought battle, but in the end Romney didn't have the numbers to overpower Obama.
defeat	Bush	While at first the numbers were on his side, eventually Gore had to admit defeat to Bush in 2000.
frontrunner	primary	While Perry appeared to be the frontrunner, Romney came out ahead in the GOP primary.
race	presidential	In the presidential race of 2008, John McCain came up short.
knocked out	election	During the Democratic primary in 2008, John Edwards came out swinging but was swiftly knocked out of the election.
step	life	It's time to take the next big step in my life.
far	life	She hasn't gone as far in life as her parents had hoped.
course	life	His life has taken a good course.
traveled	life	As I've traveled through life, I've made a lot of friends along the way.
direction	life	He has changed his direction in life, and taken a more spiritual path.
little	money	She has very little money.
shrink	number	The number of available parking spaces continues to shrink.
churning out	bills	Congress is producing little this election year that will become law, yet both parties are churning out bills designed to make the other side look bad.
give	idea	This gives me a great idea!
got	idea	I got a much better idea of what was going on after the last meeting.
acquired	knowledge	She had acquired an intimate knowledge of the terrain, which now helped her to travel quickly.
gave	experience	Her experience gave her a great deal of knowledge.
steering	country	The president is steering the country into unknown waters.
drove	nation	The president drove the nation into a ditch.
drove	country	Obama on GOP: 'They Drove The Country Into A Ditch...Now They Want The Keys Back'
drove	country	Where was he when he drove our country off a cliff?
head	country	Obama is the head of the country, whether some people don't like democracy or not.
grow	legislation	Out of these discussions will grow legislation of farreaching importance.
dismantle	laws	dismantle gun laws
build	law	How to Build A Law
pillars	democracy	Aug 25, 2010 – And so, two of the main pillars of our democracy—a free press and the courts—will be assailed at the same time.
put my finger	idea	I've almost got an idea, but I can't quite put my finger on it.
put my finger	problem	I could never put my finger on what the problem was. I felt crazy at times and there were so many times that I would approach him with a very well-thought out ...
see	mean	I see what you mean.
see	mean	I see what you mean.
referee	judge	Feb 24, 2007 – A judge is often thought of in terms of a referree. But can a judge really be as objective as a sporting umpire?
fabric	society	Emigration has threatened to unravel the fabric of this small society.
weave	coalition	The chairman has managed to weave together quite a coalition
friend	country	Which country is your country's best friend?
appetite	learning	He has an appetite for learning.
insatiable	curiosity	He has an insatiable curiosity.
heated up	trading	Trading has really heated up this week.
walls	Church	The Crumbling Walls of the Roman Catholic Church
health	institution	May 27, 2011 – The “health” of an institution is measured by the effectiveness of its organization and mission, and also by how well it plans for the future.
vehicles	institution	I would venture to conclude from this that institutions are vehicles of subcultures driven by groups of people with a common destination
machines	institution	More especially, the analogy mentioned between institutions and machines must not be interpreted as proposing the theory that institutions are machines—in some essentialist sense.
factories	institutions	Society’s great institutions are factories of ideas, regularly churning out new frameworks, insights, and understanding.
factories	institutions	In this view, educational instititions are factories that take less productive workers as their raw materials, apply doses of training, and create more productive workers as outputs.
businesses	institutions	Religious institutions are businesses, the sermons are infomercials, the verse are nothing but commercial slogans.
Businesses	Institutions	Institutions Are Businesses, Too
blocked	legislation	Senate Republicans blocked legislation Wednesday that would have established a  billion jobs program putting veterans back to work tending to the country's federal lands and bolstering local police and fire departments.
obstruct	bill	This mini-controversy erupted when Republicans introduced a string of amendments in a final effort to obstruct passage of the reconciliation bill.
get out	information	The detective couldn't get much information out of the partial shoe print.
contain	story	Tree rings contain the story of the region.
yielded	information	It was years before the fossils yielded any valuable information.
leads	Germany	Germany Leads the World
leads	China	China leads successful wildlife crime crackdown
ladder	social	Moving up the social ladder: The bottom rung vs the top rung
diet	government	Tom Barrett: Put state government on a diet
business	government	The business of municipal government is, in general, the most poorly managed business in the world.
drowning	debt	Debt, debt, debt; we're drowning in it. This morning, the Office for National Statistics published the latest estimates of public sector borrowing. Though borrowing is falling faster than anticipated, thanks to the fact that spending cuts are finally beginning to kick in, the national debt has risen to 64.2 per cent of GDP. More significantly, we now owe more than £1 trillion, or around £16,000 for every person in the country.
transparency	government	Increasing transparency in government (title of article, International Journal on World Peace)
infected	crime	As It Opens to Outsiders, Cuba Is Infected by Crime
central	issue	The issue is central to these negotiations.
lightweight	issue	That's a lightweight issue.
substantial	problem	This is a substantive / substantial problem for us.
small	player	Texaco is a relatively small player in the California gasoline market but a bigger factor in the Eastern states that want to follow California's lead.
disintegration	moral	The consequence of idolatry is the moral disintegration of human society.
crooked	politician	He's a crooked politician.
shatter	rules	Shatter the rules of the market economy
have	idea	I have an idea.
gave	idea	She gave me a good idea.
gave birth	ideas	The theory of relativity gave birth to an enormous number of ideas in physics.
father	biology	He is the father of modern biology.
spawned	ideas	Look at what his ideas have spawned.
died	ideas	Those ideas died off in the Middle Ages.
live	ideas	His ideas will live on forever.
infancy	cognitive psychology	Cognitive psychology is still in its infancy.
resurrected	idea	That's an idea that ought to be resurrected.
breathed new life	idea	He breathed new life into that idea.
indigestible	facts	This is what happens when science serves up facts more indigestible than evolution. We end up with a society where the masses live in outright ignorance and denial, while the dominant institutions, thanks to market and political expediency, continually reorganize themselves around actionable intelligence as it comes in.
food	thought	Food for thought nust be appetizing. Chemistry students usually can write acceptable exposition if they know good writing is expected
rise	top	He'll rise to the top.
peak	career	He's at the peak of his career.
ladder	success	He's climbing the ladder of success.
hierarchy	social	They are at the bottom of the social hierarchy.
fell	status	She fell in status.
top	supervisor	He's gone over my head to the top supervisor.
down	flu	He's down with the flu.
peak	health	He's at the peak of health.
top	shape	He's in top shape.
boosted	spirits	That boosted my spirits.
rose	spirits	My spirits rose.
high	spirits	You're in high spirits.
soaring	joy	I'm soaring with joy.
fell	spirits	His spirits fell.
infested	gun	gun-infested state
altar	gun	altar of gun ownership
worship	guns	worship guns
glorify	firearms	glorify firearms
addicted	guns	The primary reason Americans are addicted to guns is due to the National Rifle Association's very effective — and immoral — campaign to instill fear into the heart of our citizens, which has paralyzed the soul of America.
avalanche	guns	avalanche of guns
disease	gun	‘America’s gun disease is a national security issue’
cancerous	gun violence	cancerous gun violence
plague	gun violence	plague of gun violence
killed	debate	Cynicism has killed the gun-control debate
saddle	gun control	saddle the American people with gun control
trap	gun control	gun control trap
sickness	gun control	gun control sickness
shackles	gun control	oppressive shackles of gun control
squashed	gun lobby	the gun lobby has squashed federal funding
guided	problem	She guided him through the problem.
walked	analysis	She walked him through the analysis.
led	course	She led him through the rough parts of the course.
belongs	cluster	The Milky Way belongs to a cluster of galaxies.
has	galaxy	Our galaxy has at least 100 billion planets.
part	group	"Earth is part of the group of ""terrestrial"" planets."
contains	group	This group contains twenty members.
in	group	There are twenty members in this group.
salivated	earning	He salivated with the thought of earning more money.
hungered	profits	The robber baron hungered for even greater profits.
moved closer	Democrats and Republicans	House Democrats and Republicans moved closer to agreeing on a budget today.
shore up	freedom	The government must shore up support for our religious freedoms.
strengthen	liberties	We need to strengthen our civil liberties.
invaded	laws	These gay marriage laws have invaded our religious rights.
stay out	government	The government needs to stay out of my bedroom.
trampling	rights	The government's move to censor the internet is trampling all over our rights to free speech and freedom of the press.
steal	rights	Overturning Roe v. Wade would steal away our right to privacy.
overstepped	wiretapping	The government overstepped a line when they proposed wiretapping citizens' phone lines.
encroaching	freedom	Gay marriage is encroaching on our religious freedoms.
chips away	freedom	Every new bill the President proposes chips away at our freedoms.
undermine	imposing	Imposing martial law will undermine the very foundations of democracy.
assault	liberties	Gun control is an assault on our civil liberties.
suffocated	regulations	The entrepreneur was suffocated by the all the onerous regulations he had to follow.
suffocated	red tape	Small business in the United States is literally being suffocated by red tape.
holding back	regulations	The restrictive regulations are holding back innovation.
handcuff	regulation	Any greater government regulation will only handcuff the industry and reduce the significant benefits hedge funds offer to the markets.
burden	regulations	The burdens of regulation on corporations hold down their profit margins.
obstacles	regulations	All these rules and regulations are obstacles to innovation.
muscle	government	China Using Government Muscle to Turbo Charge its Auto Industry
muscle	government	India government regains its muscle with reforms
referee	government	Government should be a referee, not an active player
withered	government	Withered government: leave it to the rich
living thing	government	"“Government is not a machine, but a living thing. It falls, not under the theory of the universe, but under the theory of organic life. It is accountable to Darwin, not to Newton. It is modified by its environment, necessitated by its tasks, shaped to its functions by the sheer pressure of life. No living thing can have its organs offset against each other, as checks, and live."""
slave master	government	There can be no doubt that the federal government is the new slave master, something the Founding Fathers warned us against.
